{
  "schema_version": "square.session-read-model/v1",
  "id": "session-done",
  "project_id": "project-square",
  "title": "Documentation cleanup",
  "status": "SUCCEEDED",
  "attention": {
    "kind": "NONE",
    "count": 0,
    "summary": null
  },
  "created_at": "2026-08-09T00:45:00Z",
  "updated_at": "2026-08-09T02:00:00Z",
  "active_workflow_run_id": null,
  "messages": [
    {
      "id": "m-d-1",
      "author": "USER",
      "author_ref": null,
      "content": "Clean the outdated links and verify the docs.",
      "created_at": "2026-08-09T00:45:00Z",
      "artifact_refs": []
    },
    {
      "id": "m-d-2",
      "author": "TASK_MANAGER",
      "author_ref": "rr-d-tm",
      "content": "Completed. Targeted docs validation passed and the final terminal history is retained.",
      "created_at": "2026-08-09T01:12:00Z",
      "artifact_refs": []
    }
  ],
  "workflow_runs": [
    {
      "schema_version": "square.workflow-run/v1",
      "id": "wf-done",
      "session_id": "session-done",
      "profile": "AUTO",
      "resolved_profile": "QUICK",
      "status": "SUCCEEDED",
      "stage": "Done",
      "baseline": {
        "kind": "GIT_COMMIT",
        "value": "bd5e4ec30c0f2e4e31fea82d48ae700cdb5f041f"
      },
      "role_runs": [
        {
          "schema_version": "square.role-run/v1",
          "id": "rr-d-tm",
          "workflow_run_id": "wf-done",
          "task_id": null,
          "role": "TASK_MANAGER",
          "title": "Coordinate documentation cleanup",
          "attempt": 1,
          "state": "SUCCEEDED",
          "requested_route": null,
          "resolved_route": null,
          "actual_identity": {
            "harness": null,
            "model": null,
            "provider": null,
            "verification": "UNVERIFIED",
            "source": null
          },
          "permission": "NONE",
          "ao_binding": null,
          "attention": null,
          "artifacts": [
            "artifact:receipt-done"
          ],
          "started_at": "2026-08-09T01:00:00Z",
          "finished_at": "2026-08-09T01:12:00Z",
          "version": 1
        },
        {
          "schema_version": "square.role-run/v1",
          "id": "rr-d-worker",
          "workflow_run_id": "wf-done",
          "task_id": null,
          "role": "WORKER",
          "title": "Clean documentation links",
          "attempt": 1,
          "state": "SUCCEEDED",
          "requested_route": "codex/coding-primary",
          "resolved_route": "codex/coding-primary",
          "actual_identity": {
            "harness": "codex",
            "model": "gpt-coding-primary",
            "provider": null,
            "verification": "VERIFIED",
            "source": "adapter-startup"
          },
          "permission": "WRITER",
          "ao_binding": {
            "ao_session_id": "ao-d-01",
            "controller_generation": 1,
            "worktree": "D:/worktrees/sq-docs",
            "branch": "square/docs-cleanup",
            "pr": "https://example.invalid/pr/42",
            "mode": "TERMINAL"
          },
          "attention": null,
          "artifacts": [
            "artifact:validation-done"
          ],
          "started_at": "2026-08-09T01:00:00Z",
          "finished_at": "2026-08-09T01:10:00Z",
          "version": 1
        }
      ],
      "receipt_id": "receipt-done",
      "version": 1
    }
  ],
  "available_actions": [
    "START_NEW_RUN",
    "ARCHIVE",
    "OPEN_RECEIPT"
  ],
  "version": 1
}
