{
  "schema_version": "square.session-read-model/v1",
  "id": "session-planned",
  "project_id": "project-square",
  "title": "Build the session-first Square workspace",
  "status": "RUNNING",
  "attention": {
    "kind": "NONE",
    "count": 0,
    "summary": null
  },
  "created_at": "2026-08-09T00:45:00Z",
  "updated_at": "2026-08-09T02:00:00Z",
  "active_workflow_run_id": "wf-planned",
  "messages": [
    {
      "id": "m-p-1",
      "author": "USER",
      "author_ref": null,
      "content": "Build the session-first workflow with configurable models per role.",
      "created_at": "2026-08-09T00:45:00Z",
      "artifact_refs": []
    },
    {
      "id": "m-p-2",
      "author": "TASK_MANAGER",
      "author_ref": "rr-p-tm",
      "content": "Plan accepted. Backend and frontend workers are running in isolated AO worktrees.",
      "created_at": "2026-08-09T01:42:00Z",
      "artifact_refs": []
    }
  ],
  "workflow_runs": [
    {
      "schema_version": "square.workflow-run/v1",
      "id": "wf-planned",
      "session_id": "session-planned",
      "profile": "AUTO",
      "resolved_profile": "PLANNED",
      "status": "IMPLEMENTING",
      "stage": "Implement",
      "baseline": {
        "kind": "GIT_COMMIT",
        "value": "bd5e4ec30c0f2e4e31fea82d48ae700cdb5f041f"
      },
      "role_runs": [
        {
          "schema_version": "square.role-run/v1",
          "id": "rr-p-tm",
          "workflow_run_id": "wf-planned",
          "task_id": null,
          "role": "TASK_MANAGER",
          "title": "Coordinate planned workflow",
          "attempt": 1,
          "state": "RUNNING",
          "requested_route": null,
          "resolved_route": null,
          "actual_identity": {
            "harness": null,
            "model": null,
            "provider": null,
            "verification": "UNVERIFIED",
            "source": null
          },
          "permission": "NONE",
          "ao_binding": null,
          "attention": null,
          "artifacts": [
            "artifact:task-brief",
            "artifact:context-pack",
            "artifact:plan"
          ],
          "started_at": "2026-08-09T01:00:00Z",
          "finished_at": null,
          "version": 1
        },
        {
          "schema_version": "square.role-run/v1",
          "id": "rr-p-planner",
          "workflow_run_id": "wf-planned",
          "task_id": null,
          "role": "PLANNER",
          "title": "Design session-first state model",
          "attempt": 1,
          "state": "SUCCEEDED",
          "requested_route": "claude/strong-planning",
          "resolved_route": "claude/strong-planning",
          "actual_identity": {
            "harness": "claude-code",
            "model": "opus-planning",
            "provider": null,
            "verification": "VERIFIED",
            "source": "adapter-startup"
          },
          "permission": "READ_ONLY",
          "ao_binding": {
            "ao_session_id": "ao-p-02",
            "controller_generation": 1,
            "worktree": null,
            "branch": null,
            "pr": null,
            "mode": "CHAT"
          },
          "attention": null,
          "artifacts": [
            "artifact:plan"
          ],
          "started_at": "2026-08-09T01:00:00Z",
          "finished_at": "2026-08-09T01:25:00Z",
          "version": 1
        },
        {
          "schema_version": "square.role-run/v1",
          "id": "rr-p-orch",
          "workflow_run_id": "wf-planned",
          "task_id": null,
          "role": "ORCHESTRATOR",
          "title": "Compile worker dispatch packets",
          "attempt": 1,
          "state": "SUCCEEDED",
          "requested_route": "claude/strong-synthesis",
          "resolved_route": "claude/strong-synthesis",
          "actual_identity": {
            "harness": "claude-code",
            "model": "opus-synthesis",
            "provider": null,
            "verification": "VERIFIED",
            "source": "adapter-startup"
          },
          "permission": "READ_ONLY",
          "ao_binding": {
            "ao_session_id": "ao-p-03",
            "controller_generation": 1,
            "worktree": null,
            "branch": null,
            "pr": null,
            "mode": "CHAT"
          },
          "attention": null,
          "artifacts": [
            "artifact:execution-packets"
          ],
          "started_at": "2026-08-09T01:00:00Z",
          "finished_at": "2026-08-09T01:40:00Z",
          "version": 1
        },
        {
          "schema_version": "square.role-run/v1",
          "id": "rr-p-worker-a",
          "workflow_run_id": "wf-planned",
          "task_id": null,
          "role": "WORKER",
          "title": "Implement backend session records",
          "attempt": 1,
          "state": "RUNNING",
          "requested_route": "codex/coding-primary",
          "resolved_route": "codex/coding-primary",
          "actual_identity": {
            "harness": "codex",
            "model": "gpt-coding-primary",
            "provider": null,
            "verification": "VERIFIED",
            "source": "adapter-startup"
          },
          "permission": "WRITER",
          "ao_binding": {
            "ao_session_id": "ao-p-04",
            "controller_generation": 2,
            "worktree": "D:/worktrees/sq-backend",
            "branch": "square/session-domain",
            "pr": null,
            "mode": "TERMINAL"
          },
          "attention": null,
          "artifacts": [],
          "started_at": "2026-08-09T01:00:00Z",
          "finished_at": null,
          "version": 1
        },
        {
          "schema_version": "square.role-run/v1",
          "id": "rr-p-worker-b",
          "workflow_run_id": "wf-planned",
          "task_id": null,
          "role": "WORKER",
          "title": "Implement React session tabs",
          "attempt": 1,
          "state": "RUNNING",
          "requested_route": "claude/ui-coding",
          "resolved_route": "claude/ui-coding",
          "actual_identity": {
            "harness": "claude-code",
            "model": "sonnet-ui",
            "provider": null,
            "verification": "REPORTED",
            "source": "adapter-startup"
          },
          "permission": "WRITER",
          "ao_binding": {
            "ao_session_id": "ao-p-05",
            "controller_generation": 1,
            "worktree": "D:/worktrees/sq-frontend",
            "branch": "square/session-ui",
            "pr": null,
            "mode": "CHAT"
          },
          "attention": null,
          "artifacts": [],
          "started_at": "2026-08-09T01:00:00Z",
          "finished_at": null,
          "version": 1
        },
        {
          "schema_version": "square.role-run/v1",
          "id": "rr-p-review",
          "workflow_run_id": "wf-planned",
          "task_id": null,
          "role": "REVIEWER",
          "title": "Independent acceptance review",
          "attempt": 1,
          "state": "WAITING_CAPACITY",
          "requested_route": "auto/review-independent",
          "resolved_route": null,
          "actual_identity": {
            "harness": null,
            "model": null,
            "provider": null,
            "verification": "UNVERIFIED",
            "source": null
          },
          "permission": "REVIEW_ONLY",
          "ao_binding": null,
          "attention": null,
          "artifacts": [],
          "started_at": null,
          "finished_at": null,
          "version": 1
        }
      ],
      "receipt_id": null,
      "version": 1
    }
  ],
  "available_actions": [
    "PAUSE",
    "CANCEL",
    "SEND_MESSAGE",
    "OPEN_PLAN"
  ],
  "version": 1
}
