{
  "schema_version": "square.session-read-model/v1",
  "id": "session-blocked",
  "project_id": "project-square",
  "title": "Keep work running when the desktop closes",
  "status": "WAITING_FOR_USER",
  "attention": {
    "kind": "NEEDS_USER",
    "count": 1,
    "summary": "Accept or reject the detached daemon solution."
  },
  "created_at": "2026-08-09T00:45:00Z",
  "updated_at": "2026-08-09T02:00:00Z",
  "active_workflow_run_id": "wf-blocked",
  "messages": [
    {
      "id": "m-b-1",
      "author": "USER",
      "author_ref": null,
      "content": "Workers must continue when I close the desktop.",
      "created_at": "2026-08-09T00:50:00Z",
      "artifact_refs": []
    },
    {
      "id": "m-b-2",
      "author": "TASK_MANAGER",
      "author_ref": "rr-b-tm",
      "content": "A product-lifetime decision is required. Proposed solution: detached per-user daemon with reconnectable UI.",
      "created_at": "2026-08-09T01:32:00Z",
      "artifact_refs": []
    }
  ],
  "workflow_runs": [
    {
      "schema_version": "square.workflow-run/v1",
      "id": "wf-blocked",
      "session_id": "session-blocked",
      "profile": "AUTO",
      "resolved_profile": "PLANNED",
      "status": "PLAN_APPROVAL_REQUIRED",
      "stage": "Plan approval",
      "baseline": {
        "kind": "GIT_COMMIT",
        "value": "bd5e4ec30c0f2e4e31fea82d48ae700cdb5f041f"
      },
      "role_runs": [
        {
          "schema_version": "square.role-run/v1",
          "id": "rr-b-tm",
          "workflow_run_id": "wf-blocked",
          "task_id": null,
          "role": "TASK_MANAGER",
          "title": "Coordinate daemon lifetime fix",
          "attempt": 1,
          "state": "BLOCKED",
          "requested_route": null,
          "resolved_route": null,
          "actual_identity": {
            "harness": null,
            "model": null,
            "provider": null,
            "verification": "UNVERIFIED",
            "source": null
          },
          "permission": "NONE",
          "ao_binding": null,
          "attention": {
            "kind": "PLAN_APPROVAL",
            "summary": "Owner decision required before changing daemon lifetime.",
            "interaction_id": "interaction-b-1"
          },
          "artifacts": [],
          "started_at": "2026-08-09T01:00:00Z",
          "finished_at": null,
          "version": 1
        },
        {
          "schema_version": "square.role-run/v1",
          "id": "rr-b-orch",
          "workflow_run_id": "wf-blocked",
          "task_id": null,
          "role": "ORCHESTRATOR",
          "title": "Propose detached daemon architecture",
          "attempt": 1,
          "state": "SUCCEEDED",
          "requested_route": "claude/strong-synthesis",
          "resolved_route": "claude/strong-synthesis",
          "actual_identity": {
            "harness": "claude-code",
            "model": "opus-synthesis",
            "provider": null,
            "verification": "VERIFIED",
            "source": "adapter-startup"
          },
          "permission": "READ_ONLY",
          "ao_binding": null,
          "attention": null,
          "artifacts": [
            "artifact:daemon-lifetime-proposal"
          ],
          "started_at": "2026-08-09T01:00:00Z",
          "finished_at": "2026-08-09T01:30:00Z",
          "version": 1
        },
        {
          "schema_version": "square.role-run/v1",
          "id": "rr-b-worker",
          "workflow_run_id": "wf-blocked",
          "task_id": null,
          "role": "WORKER",
          "title": "Implement lifetime change",
          "attempt": 1,
          "state": "WAITING_FOR_APPROVAL",
          "requested_route": "codex/coding-primary",
          "resolved_route": "codex/coding-primary",
          "actual_identity": {
            "harness": "codex",
            "model": "gpt-coding-primary",
            "provider": null,
            "verification": "VERIFIED",
            "source": "adapter-startup"
          },
          "permission": "WRITER",
          "ao_binding": {
            "ao_session_id": "ao-b-01",
            "controller_generation": 1,
            "worktree": "D:/worktrees/sq-daemon",
            "branch": "square/detached-daemon",
            "pr": null,
            "mode": "TERMINAL"
          },
          "attention": {
            "kind": "APPROVAL",
            "summary": "Accept detached per-user daemon solution.",
            "interaction_id": "interaction-b-1"
          },
          "artifacts": [],
          "started_at": "2026-08-09T01:00:00Z",
          "finished_at": null,
          "version": 1
        }
      ],
      "receipt_id": null,
      "version": 1
    }
  ],
  "available_actions": [
    "APPROVE_SOLUTION",
    "KEEP_INVESTIGATING",
    "CANCEL"
  ],
  "version": 1
}
